{
  "kickers": [
    {
      "id": 1,
      "name": "Tsubame",
      "shortName": "Tsubame",
      "nameSpelling": "Tsubame",
      "voiceActorName": "CV: Yuma Uchida",
      "cv": "Kaito Ishikawa"
    },
    {
      "id": 2,
      "name": "Ruriha",
      "shortName": "Ruriha",
      "nameSpelling": "Ruriha",
      "voiceActorName": "CV: Ayane Sakura",
      "cv": "Azumi Waki"
    },
    {
      "id": 3,
      "name": "Coco",
      "shortName": "Coco",
      "nameSpelling": "Coco Guamrail",
      "voiceActorName": "CV: Hiromi Igarashi",
      "cv": "Yuki Kuwahara"
    },
    {
      "id": 4,
      "name": "Kite",
      "shortName": "Kite",
      "nameSpelling": "Kite",
      "voiceActorName": "CV: Kaito Ishikawa",
      "cv": "Kouki Uchiyama"
    },
    {
      "id": 5,
      "name": "Owlbert",
      "shortName": "Owlbert",
      "nameSpelling": "Owlbert",
      "voiceActorName": "CV: Nobuhiko Okamoto",
      "cv": "Mutsumi Tamura"
    },
    {
      "id": 6,
      "name": "Pitophy",
      "shortName": "Pitophy",
      "nameSpelling": "Pitophy",
      "voiceActorName": "CV: Shizuka Ishigami",
      "cv": "Miku Ito"
    },
    {
      "id": 7,
      "name": "Grenhawk",
      "shortName": "Grenhawk",
      "nameSpelling": "Grenhawk",
      "voiceActorName": "CV: Tomokazu Sugita",
      "cv": "Hiroki Yasumoto"
    },
    {
      "id": 8,
      "name": "Anna",
      "shortName": "Anna",
      "nameSpelling": "Anna Starling",
      "voiceActorName": "CV: Saori Hayami",
      "cv": "Shizuka Ito"
    },
    {
      "id": 9,
      "name": "Jay",
      "shortName": "Jay",
      "nameSpelling": "Jay",
      "voiceActorName": "CV: Hiroyuki Yoshino",
      "cv": "Hiroyuki Yoshino"
    },
    {
      "id": 10,
      "name": "Yuyan",
      "shortName": "Yuyan",
      "nameSpelling": "Yuyan",
      "voiceActorName": "CV: Koki Uchiyama",
      "cv": "Yu Kobayashi"
    },
    {
      "id": 11,
      "name": "Diatrius",
      "shortName": "Diatrius",
      "nameSpelling": "Diatrius",
      "voiceActorName": "CV: Hiroki Yasumoto",
      "cv": "Tetsu Inada"
    },
    {
      "id": 12,
      "name": "Buzzy Big",
      "shortName": "Buzzy Big",
      "nameSpelling": "Buzzy Big",
      "voiceActorName": "CV: Subaru Kimura",
      "cv": "Subaru Kimura"
    },
    {
      "id": 13,
      "name": "Hitagi",
      "shortName": "Hitagi",
      "nameSpelling": "Hitagi",
      "voiceActorName": "CV: Houko Kuwashima",
      "cv": "Rika Tachibana"
    },
    {
      "id": 14,
      "name": "Sid",
      "shortName": "Sid",
      "nameSpelling": "Sid",
      "voiceActorName": "CV: Showtaro Morikubo",
      "cv": "Tomokazu Sugita"
    }
  ],
  "parameters": [
    {
      "id": 1,
      "kickerId": 1,
      "roleType": 0,
      "weaponType": 0,
      "maxHp": 1000,
      "attack": 100,
      "defense": 100,
      "speed": 10.0,
      "moveSpeedCoefficient": 1.0,
      "moveTurningSpeedCoefficient": 1.0,
      "moveDashSpeedCoefficient": 1.0,
      "groundMoveSpeedCoefficient": 1.0,
      "groundMoveTurningSpeedCoefficient": 1.0,
      "acceleration": 1.0,
      "attackTargetSearchDistance": 3.0,
      "attackTargetSearchAngle": 60.0,
      "skillId": 20001,
      "dashAttackRange": 8.0,
      "dashAttackSpeedWeight": 3.0,
      "dashAttackTime": 1.0,
      "dashAttackFollowThroughTime": 0.6,
      "footHeight": 0.79,
      "height": 1.64,
      "recoveryBoostPoint": 10.0,
      "recoveryBoostPointGround": 15.0,
      "addMoveSpecialSkillPoint": 0.1351,
      "addWeaponAttackSpecialSkillPoint": 1.0,
      "hpCorrection": 1.0,
      "attackCorrection": 1.0
    },
    {
      "id": 2,
      "kickerId": 2,
      "roleType": 1,
      "weaponType": 1,
      "maxHp": 850,
      "attack": 80,
      "defense": 100,
      "speed": 9.6,
      "moveSpeedCoefficient": 1.0,
      "moveTurningSpeedCoefficient": 1.0,
      "moveDashSpeedCoefficient": 1.0,
      "groundMoveSpeedCoefficient": 1.0,
      "groundMoveTurningSpeedCoefficient": 1.0,
      "acceleration": 1.0,
      "attackTargetSearchDistance": 18.0,
      "attackTargetSearchAngle": 60.0,
      "skillId": 20002,
      "dashAttackRange": 16.0,
      "dashAttackSpeedWeight": 1.0,
      "dashAttackTime": 0.5,
      "dashAttackFollowThroughTime": 0.3,
      "footHeight": 0.89,
      "height": 1.58,
      "recoveryBoostPoint": 10.0,
      "recoveryBoostPointGround": 15.0,
      "addMoveSpecialSkillPoint": 0.125,
      "addWeaponAttackSpecialSkillPoint": 1.0,
      "hpCorrection": 0.85,
      "attackCorrection": 0.8
    },
    {
      "id": 3,
      "kickerId": 3,
      "roleType": 3,
      "weaponType": 2,
      "maxHp": 1350,
      "attack": 105,
      "defense": 100,
      "speed": 8.0,
      "moveSpeedCoefficient": 1.0,
      "moveTurningSpeedCoefficient": 1.0,
      "moveDashSpeedCoefficient": 1.0,
      "groundMoveSpeedCoefficient": 1.0,
      "groundMoveTurningSpeedCoefficient": 1.0,
      "acceleration": 1.0,
      "attackTargetSearchDistance": 3.0,
      "attackTargetSearchAngle": 60.0,
      "skillId": 20003,
      "dashAttackRange": 8.0,
      "dashAttackSpeedWeight": 3.0,
      "dashAttackTime": 1.0,
      "dashAttackFollowThroughTime": 0.6,
      "footHeight": 0.81,
      "height": 1.56,
      "recoveryBoostPoint": 10.0,
      "recoveryBoostPointGround": 15.0,
      "addMoveSpecialSkillPoint": 0.125,
      "addWeaponAttackSpecialSkillPoint": 1.0,
      "hpCorrection": 1.35,
      "attackCorrection": 1.05
    },
    {
      "id": 4,
      "kickerId": 4,
      "roleType": 2,
      "weaponType": 3,
      "maxHp": 1000,
      "attack": 130,
      "defense": 100,
      "speed": 9.2,
      "moveSpeedCoefficient": 1.0,
      "moveTurningSpeedCoefficient": 1.0,
      "moveDashSpeedCoefficient": 1.0,
      "groundMoveSpeedCoefficient": 1.0,
      "groundMoveTurningSpeedCoefficient": 1.0,
      "acceleration": 1.0,
      "attackTargetSearchDistance": 20.0,
      "attackTargetSearchAngle": 60.0,
      "skillId": 20004,
      "dashAttackRange": 16.0,
      "dashAttackSpeedWeight": 1.0,
      "dashAttackTime": 0.5,
      "dashAttackFollowThroughTime": 0.3,
      "footHeight": 0.83,
      "height": 1.67,
      "recoveryBoostPoint": 10.0,
      "recoveryBoostPointGround": 15.0,
      "addMoveSpecialSkillPoint": 0.1183,
      "addWeaponAttackSpecialSkillPoint": 1.0,
      "hpCorrection": 1.0,
      "attackCorrection": 1.3
    },
    {
      "id": 5,
      "kickerId": 5,
      "roleType": 1,
      "weaponType": 4,
      "maxHp": 1200,
      "attack": 90,
      "defense": 100,
      "speed": 8.4,
      "moveSpeedCoefficient": 1.0,
      "moveTurningSpeedCoefficient": 1.0,
      "moveDashSpeedCoefficient": 1.0,
      "groundMoveSpeedCoefficient": 1.0,
      "groundMoveTurningSpeedCoefficient": 1.0,
      "acceleration": 1.0,
      "attackTargetSearchDistance": 16.0,
      "attackTargetSearchAngle": 60.0,
      "skillId": 20005,
      "dashAttackRange": 16.0,
      "dashAttackSpeedWeight": 1.0,
      "dashAttackTime": 0.5,
      "dashAttackFollowThroughTime": 0.3,
      "footHeight": 0.78,
      "height": 1.62,
      "recoveryBoostPoint": 10.0,
      "recoveryBoostPointGround": 15.0,
      "addMoveSpecialSkillPoint": 0.1538,
      "addWeaponAttackSpecialSkillPoint": 1.0,
      "hpCorrection": 1.2,
      "attackCorrection": 0.9
    },
    {
      "id": 6,
      "kickerId": 6,
      "roleType": 2,
      "weaponType": 5,
      "maxHp": 900,
      "attack": 145,
      "defense": 100,
      "speed": 8.96,
      "moveSpeedCoefficient": 1.0,
      "moveTurningSpeedCoefficient": 1.0,
      "moveDashSpeedCoefficient": 1.0,
      "groundMoveSpeedCoefficient": 1.0,
      "groundMoveTurningSpeedCoefficient": 1.0,
      "acceleration": 1.0,
      "attackTargetSearchDistance": 25.0,
      "attackTargetSearchAngle": 60.0,
      "skillId": 20006,
      "dashAttackRange": 16.0,
      "dashAttackSpeedWeight": 1.0,
      "dashAttackTime": 0.5,
      "dashAttackFollowThroughTime": 0.3,
      "footHeight": 0.52,
      "height": 1.3,
      "recoveryBoostPoint": 10.0,
      "recoveryBoostPointGround": 15.0,
      "addMoveSpecialSkillPoint": 0.1538,
      "addWeaponAttackSpecialSkillPoint": 1.0,
      "hpCorrection": 0.9,
      "attackCorrection": 1.45
    },
    {
      "id": 7,
      "kickerId": 7,
      "roleType": 1,
      "weaponType": 8,
      "maxHp": 1050,
      "attack": 95,
      "defense": 100,
      "speed": 8.16,
      "moveSpeedCoefficient": 1.0,
      "moveTurningSpeedCoefficient": 1.0,
      "moveDashSpeedCoefficient": 1.0,
      "groundMoveSpeedCoefficient": 1.0,
      "groundMoveTurningSpeedCoefficient": 1.0,
      "acceleration": 1.0,
      "attackTargetSearchDistance": 24.0,
      "attackTargetSearchAngle": 60.0,
      "skillId": 20007,
      "dashAttackRange": 16.0,
      "dashAttackSpeedWeight": 1.0,
      "dashAttackTime": 0.5,
      "dashAttackFollowThroughTime": 0.3,
      "footHeight": 0.99,
      "height": 1.91,
      "recoveryBoostPoint": 10.0,
      "recoveryBoostPointGround": 15.0,
      "addMoveSpecialSkillPoint": 0.1316,
      "addWeaponAttackSpecialSkillPoint": 1.0,
      "hpCorrection": 1.05,
      "attackCorrection": 0.95
    },
    {
      "id": 8,
      "kickerId": 8,
      "roleType": 0,
      "weaponType": 6,
      "maxHp": 1100,
      "attack": 85,
      "defense": 100,
      "speed": 9.6,
      "moveSpeedCoefficient": 1.0,
      "moveTurningSpeedCoefficient": 1.0,
      "moveDashSpeedCoefficient": 1.0,
      "groundMoveSpeedCoefficient": 1.0,
      "groundMoveTurningSpeedCoefficient": 1.0,
      "acceleration": 1.0,
      "attackTargetSearchDistance": 20.0,
      "attackTargetSearchAngle": 60.0,
      "skillId": 20008,
      "dashAttackRange": 16.0,
      "dashAttackSpeedWeight": 1.0,
      "dashAttackTime": 0.5,
      "dashAttackFollowThroughTime": 0.3,
      "footHeight": 1.02,
      "height": 1.82,
      "recoveryBoostPoint": 10.0,
      "recoveryBoostPointGround": 15.0,
      "addMoveSpecialSkillPoint": 0.0667,
      "addWeaponAttackSpecialSkillPoint": 1.0,
      "hpCorrection": 1.1,